Go to Google Images Home	Ir a la página principal de Imágenes de Google
This result contains offensive content	Este resultado incluye contenido ofensivo.
Hide the ability to remove results or comment on results.	Ocultar la posibilidad de eliminar resultados o hacer comentarios.
Go to Google Groups Home	Ir a la página principal de Grupos de Google
Unlocking could not be completed across all Google domains.	No se ha podido completar el desbloqueo en todos los dominios de Google.
Walking directions are in beta.	Las rutas a pie están en versión beta.
All notes for this SearchWiki	Todas las notas de esta wikibúsqueda
Drag to resize image	Arrastra para cambiar el tamaño de la imagen
Search from Mobile Phone	Buscar desde un teléfono móvil
However, there are results from websites with similar addresses:	Sin embargo, hay resultados de sitios web con direcciones similares:
Sorry, this destination can not be sent to your device. Please visit the TAG_BEGINhelp pageTAG_END.	Este destino no se puede enviar a tu dispositivo. Visita la TAG_BEGINpágina de ayudaTAG_END.
Enter location or right-click on map	Introduzca una ubicación o haga clic con el botón derecho en el mapa
Want to see more photos posted by your friends?	¿Quieres ver más fotos publicadas por tus amigos?
Replace everything on this map with the uploaded file	Sustituye todos los elementos de este mapa con el archivo que has subido.
This map cannot be embedded.	Este mapa no puede incrustarse.
A website cheated me or provided poor service.	He sido víctima de una estafa por parte de un sitio web o el servicio ofrecido ha sido de baja calidad.
Because you visited this site before.	Porque ya has visitado este sitio
Return books published between the years of	Mostrar los libros publicados entre los años
Find pages similar to the page:	Encontrar páginas similares a la página:
Total area estimated from available data	Área total estimada a partir de los datos disponibles
Return articles in all subject areas.	Mostrar artículos de todas las áreas temáticas
Try reducing the size of the image.	Prueba a reducir el tamaño de la imagen.
Please describe the issue in detail, including the exact steps we can take to see the same problem.	Describe el problema de forma detallada, incluidos los pasos exactos que debemos seguir para que se produzca el mismo problema.
Please enter a description of your concern in the textbox.	Por favor, introduzca la descripción correspondiente en el cuadro de texto.
Return images from the site or domain	Mostrar solo imágenes del sitio o dominio
Try entering a zip code.	Prueba a introducir un código postal.
This ad requires JavaScript	Este anuncio requiere JavaScript.
For this search, remove this page	Para esta búsqueda, eliminar esta página
one or more of these words:	uno o varios de estos términos:
Physics, Astronomy, and Planetary Science	Física, Astronomía y Ciencias planetarias
These search terms are highlighted:	Se han resaltado estos términos de búsqueda:
Please place the marker at the issue location.	Coloca el marcador en el lugar del problema.
The images above were found by Google Image Search and may be subject to copyright.	Las imágenes anteriores se han encontrado mediante la Búsqueda de imágenes de Google y es posible que estén protegidas por derechos de autor.
See nearby transit stations.	Encuentra estaciones de transporte público próximas.
See user-created content	Ver contenido creado por los usuarios
Return patents with the patent title	Mostrar patentes con su título
This service is currently unavailable.LINE_BREAKPlease try again later.	El servicio no está disponible en este momento.LINE_BREAKVuelve a intentarlo más tarde.
We are sorry, our phone service is temporarily unavailable.  Please try again later.	Lo sentimos, pero nuestro servicio telefónico no está disponible temporalmente. Inténtalo más tarde.
Old, musty, remnant of American history	Aroma a antiguos y mohosos vestigios de la historia de Estados Unidos
Have a new site to tell us about?	¿Quieres informarnos acerca de un sitio nuevo?
Browse live webcams on the map.	Navegar por las cámaras web en directo del mapa.
How do I enable cookies?	¿Cómo se activan las cookies?
Enter address or right-click on map	Introduce una dirección o haz clic con el botón derecho en el mapa.
Show products from this advertiser	Mostrar productos de este anunciante
Thanks for trying Google MapsGL. Please take a moment to let us know why you have gone back to Classic mode.	Te agradecemos que hayas probado Google MapsGL. Dedica unos minutos a informarnos sobre el motivo por el que prefieres volver al modo clásico.
Show street map with terrain	Mostrar callejero con relieve
Placement on map is approximate	La ubicación en el mapa es aproximada
Shared with everyone. This map will be published in search results and user profiles.	Será compartido con todo el mundo. Este mapa podrá publicarse en los resultados de las búsquedas y en los perfiles de los usuarios.
Was this review helpful?	¿Es útil esta reseña?
Disable customizations based on search activity	Inhabilitar personalizaciones en función de la actividad de búsqueda
It's not about a person.	No se trata de una persona.
show only advanced results	mostrar solo resultados de nivel avanzado
MapsGL crashed recently and we have reverted you to Classic.	Recientemente, se ha producido un error en MapsGL y se ha cambiado tu configuración al modo clásico.
Enter an address or drag the marker.	Escribe una dirección o arrastra el marcador.
Approve the information on this place?	¿Quieres aprobar la información sobre este lugar?
The issue has been submitted successfully.	La notificación del problema se ha enviado correctamente.
Return books written by	Mostrar libros escritos por
You made too many edits recently, please try again later.	Has hecho demasiados cambios recientemente.
No Street View available for this location	No hay ninguna imagen de Street View para esta ubicación.
Leaving the page will stop the unlocking process now in progress. Leave this page?	Al salir de la página, se detendrá el proceso de desbloqueo. ¿Seguro que quieres salir?
My business address or phone number appears incorrectly.	El número de teléfono o la dirección de mi empresa no aparece correctamente.
We're testing a new UI with Landmarks	Estamos probando una nueva interfaz de usuario con marcas de posición.
Click to start drawing a line along the roads	Haz clic para comenzar a dibujar una línea a lo largo de las calles o carreteras
All businesses at this address	Todas las empresas en esta dirección
Incident or service disruption for this agency.	Incidente o interrupción en el servicio de esta agencia
Biology, Life Sciences, and Environmental Science	Biología, Ciencias naturales y Ciencias medioambientales
Unable to read import file.	No se puede leer el archivo de importación.
Preview and full view	Vista previa y vista completa
Address or marker is incorrect	La dirección o el marcador son incorrectos
Write a comment to start a discussion on this map!	Escribe un comentario para iniciar un debate sobre este mapa.
Sort places on the map by name or most recently updated	Ordena los sitios en el mapa por nombre o por actualizaciones más recientes.
Chat with your friends while you use Google.	Chatea con tus amigos mientras utilizas Google
Search within this store	Buscar en esta tienda
Search the full text of books	Buscar en todo el texto de los libros
Moderate to Heavy Snow	Nevada de moderada a fuerte
Use of these images may require the consent from the content owner.	Es posible que se necesite la autorización del propietario del contenido para poder usar estas imágenes.
One of the results in the left panel	Uno de los resultados del panel izquierdo
Back to the previous image	Volver a la imagen anterior
Also add to my public Google profile	Añadir también a mi perfil público de Google
Converting to plain text will lose some formatting. Continue?	Si se convierte a texto sin formato perderás el formato. ¿Deseas continuar?
Add a place to the map	Añadir un lugar al mapa
Sweet bread and maple syrup on a Sunday morning	Aroma a pan dulce y jarabe de arce un domingo por la mañana
Visit official movie website	Visitar el sitio web oficial de la película
Sort by date with duplicates included	Ordenar por fecha e incluir duplicados
Filter both explicit text and explicit images	filtra tanto texto explícito como imágenes explícitas
There was an error deleting your review.  Please try again later.	Se ha producido un error al eliminar la reseña. Inténtalo más tarde.
Your change will erase some hidden details that you created when you were more zoomed in. Continue and discard the details?	El cambio eliminará algunos detalles ocultos que se crearon con la imagen más ampliada. ¿Deseas continuar y descartar los detalles?
Please wait, updating Google cookies across domains...	Actualizando cookies de Google en todos los dominios... Por favor, espera.
Make Google Your Homepage!	Haga de Google su página de inicio
Return to experiments overview	Vuelve al resumen de experimentos
Go to Google Image Search Home	Vaya a la página principal de búsqueda de imágenes de Google
What does 'Ads by Google' mean?	¿Qué significa 'Anuncios Google'?
return results of the file format	mostrar resultados en formato
Because you visited similar sites before.	Porque ya has visitado sitios similares
If you want to describe an experience you had here, consider TAG_BEGINwriting a reviewTAG_END instead.	Si quieres contar una experiencia que viviste aquí, piensa en TAG_BEGINescribir una reseñaTAG_END.
This place may be permanently closed	Es posible que este sitio esté permanentemente cerrado.
Could not retrieve comments for this page.	No ha sido posible obtener comentarios de esta página.
Labeled for noncommercial reuse with modification	Etiquetadas para reutilización no comercial con modificaciones
Add to starred images	Añadir a imágenes destacadas
This result is not about a person	Este resultado no está relacionado con una persona.
Click or drag to enter streetSPACEview	Haz clic o arrástrame para acceder a StreetSPACEView
Enter the letters you see in the image below:	Introduce las letras que aparecen en la imagen de abajo:
Traffic at day and time:	Tráfico en día y hora:
Unknown error occurred. Please try again in a few hours.	Error desconocido. Inténtalo de nuevo dentro de unas horas.
This site aggregates prices from multiple stores	Este sitio recopila precios de varias tiendas.
The images above were found by Google Image Search and may be subject to trademark or copyright.	Las imágenes anteriores se han encontrado a través de Google Imágenes y es posible que estén protegidas por derechos de autor o de marca comercial.
Enter a location or address	Indicar ubicación o dirección
Don't show any citation import links.	No mostrar enlaces para importar citas
Filter features on the map to find the exact place that you're looking for	Filtra las funciones del mapa para encontrar el sitio exacto que estás buscando.
Collaborators may invite others	Los colaboradores pueden invitar a otros.
More info for recipe publishers.	Más información para editores de recetas
The image failed to load.	No se ha podido cargar la imagen.
See your location, search for what’s nearby, and get directions to where you want to go.	Puedes ver tu ubicación, buscar lo que está más cerca de ti y conseguir indicaciones sobre cómo llegar a donde quieras.
Return patents with the assignee name	Mostrar patentes con el nombre del propietario
Incident or service disruption for this line.	Incidente o interrupción en el servicio de esta línea
Start address was not recognized.	Dirección de inicio no reconocida.
Once this map is removed, it can no longer be accessed from My Places.	Cuando el mapa se elimine, no se podrá acceder a él desde Mis sitios.
Larger photo with caption and credit.	Foto más grande con título y créditos.
Allow anyone to edit this map	Permitir a cualquier usuario editar este mapa
Embed in another service:	Incrustar en otro servicio:
Have you noticed information that could be inappropriate or private in our search results?	¿Has encontrado información inadecuada o privada en los resultados de búsqueda?
Social Sciences, Arts, and Humanities	Ciencias sociales, Arte y Humanidades
Google currently offers the following interface languages:	Google ofrece actualmente interfaces en los siguientes idiomas:
Search all Chinese pages	Buscar todas las páginas en chino
What information were you trying to find?	¿Qué tipo de información querías encontrar?
Links are not available on this test page	No hay enlaces disponibles en esta página de prueba.
For each page show	Mostrar en cada página
Tip: Use the magnifying glass on the left to get a closer look.	Sugerencia: utiliza la lupa de la izquierda para ampliar la imagen.
Video inappropriate for this map?	¿Es inadecuado el vídeo para este mapa?
Street address, city, or zip	Dirección postal, ciudad o código postal
Easily create and share personalized, annotated maps of your world	Crea y comparte mapas personalizados con anotaciones de tu propio mundo fácilmente.
No other sizes of this image found.	No se ha encontrado esta imagen en otros tamaños.
Get a pack of useful software for free	Consigue un paquete de software útil de forma gratuita.
Thank you. The new placement for this marker will appear on Google Maps soon.	Gracias. La nueva posición de este marcador aparecerá pronto en Google Maps.
See these results on a map of this region	Ver estos resultados en un mapa de la región
Do not provide results while I type but do provide predictive queries	No mostrar resultados mientras escribo pero sí mostrar búsquedas predictivas
You need to have JavaScript enabled to use this page.	Para utilizar esta página, JavaScript debe estar habilitado.
Flag Map as Inappropriate	Marcar mapa como inadecuado
If you TAG_BEGINsign inTAG_END, your feedback will take effect immediately.  Otherwise, it will first be reviewed.	Si TAG_BEGINinicias sesiónTAG_END, tus comentarios surtirán efecto inmediatamente. De lo contrario, se revisarán primero.
Return messages written in	Devolver los mensajes escritos en
Convert to filled shape	Convertir en forma llena
Learn about statistics, diagnostics, and how to manage the indexing of your website.	Consulta información sobre estadísticas, diagnósticos e instrucciones para administrar la indexación de tu sitio web.
Choose a new date and time	Selecciona una fecha y hora nuevas
The time or date displayed reflects when an article was added to or updated in Google News.	La fecha y la hora que aparecen muestran cuándo se ha actualizado o se ha añadido un artículo a Google Noticias.
See the image in its original context on the page:	Ver la imagen en su contexto original:
Updating stopped. To resume, RELOAD_LINKreload the pageCLOSE_LINK.	Se ha interrumpido la actualización. Para reanudarla, RELOAD_LINKvuelve a cargar la páginaCLOSE_LINK.
Employment, health, and much more...	Empleos, salud y mucho más...
Detours for service from this agency.	Hay desvíos en los servicios de esta agencia.
To see all the details that are visible on the screen,use the QUOTOPrintQUOTO link next to the map.	Para obtener todos los detalles que aparecen en la pantalla, utiliza el enlace QUOTOImprimirQUOTO situado junto al mapa.
Try adding a city, state, or zip code.	Intente añadir una ciudad, estado o código postal.
Some problems, but still readable	Con problemas, pero legible
What do you think about it? Share a tip.	¿Qué te parece? Comparte tu opinión.
Problems with this page?	¿Tiene problemas con esta página?
Detours for this line.	Hay desvíos en esta línea.
Discover and browse printed material online	Busque y descubra material impreso en línea
Post directly to your Google profile from any page on Google.	Publicar directamente en tu perfil de Google desde cualquier página de Google
BOLD_TAG_BEGINWriteBOLD_TAG_END reviews of businesses	BOLD_TAG_BEGINEscribeBOLD_TAG_END reseñas de negocios.
Sort top results by date	Ordenar los resultados principales por fecha
Content removed at the request of the site's publisher	Contenido eliminado por solicitud del editor del sitio
Click to continue drawing a line	Haz clic para seguir dibujando una línea.
Don't use this location as the initial map view	No utilizar esta ubicación como la vista de mapa inicial
There was a problem contacting the server, please try again.	Se ha producido un problema al contactar con el servidor. Inténtalo de nuevo.
If you would like to hear back from Google regarding your comment, please enter your email address:	Si desea recibir una respuesta de Google en relación con sus comentarios, por favor, introduzca su dirección de correo electrónico
e.g. Books and Culture	por ej., Libros y Cultura
Watch the World Cup at this location	En este lugar puedes ver los partidos del Mundial de fútbol.
Tip: Try entering a descriptive word in the search box.	Consejo: prueba a introducir una palabra descriptiva en el cuadro de búsqueda.
In my social network	En mi red social
Hide more starred results	Ocultar más resultados destacados
Matches, news, and standings	Partidos, noticias y clasificaciones
Visit the Web Search Help Center.	Visitar el Centro de ayuda de Búsqueda web de Google
The phone number is likely unlisted.	Es probable que el número de teléfono no aparezca en el listín.
Make sure the file exists.	Asegúrate de que el archivo existe.
The image below was found by Google Image Search and may be subject to copyright.	Estas imágenes se han encontrado mediante la Búsqueda de imágenes de Google y puede que estén sujetas a las leyes de protección de derechos de autor.
Street view not available in this area.	Street View no está disponible en esta zona.
Thank you. Your edit has been saved and will be visible after it has been reviewed.	Gracias. Los cambios se han guardado y aparecerán cuando se hayan revisado.
Popular products available at this store	Productos populares disponibles en esta tienda
Not available in this view. Switch to Map view to use this option.	No disponible en esta vista. Cambia a la vista "Mapa" para usar esta opción.
Find pages similar to the page	Encontrar páginas similares a la página
Search results not complying with Chinese law, regulation or policy do not appear.	No se muestran los resultados de búsqueda que vulneran la legislación, las regulaciones o las políticas chinas.
Use this location as the initial map view	Utilizar esta ubicación como la vista de mapa inicial
This option is unavailable when using Google Instant.	Esta opción no está disponible al utilizar Google Instant.
Play trailer on Youtube	Ver tráiler en YouTube
can be freely modified, adapted or built upon	puedan modificarse o adaptarse libremente o bien servir como base
Make sure all names are spelled correctly.	Asegúrese de que todos los nombres se han escrito correctamente.
Cigarette smoke and the smell of sweet, sweet victory	Olor a humo de cigarrillo y al dulce aroma de la victoria
Reduced service in this station.	Esta estación tiene servicios reducidos.
No, I want to add a new place.	No, quiero añadir un lugar nuevo.
Click the star beside any place you'll want to find again.	Haz clic en la estrella que aparece junto a cualquier lugar que quieras volver a buscar.
Provide predictive queries and results while I type	Ofrecer búsquedas y resultados predictivos mientras escribo
Return to the last result	Volver al último resultado
Try dragging these images:	Prueba a arrastrar estas imágenes:
Because of technical restrictions, you cannot edit this location at this time.	Debido a restricciones técnicas, no se puede modificar esta ubicación en estos momentos.
Search Google with an image instead of text.	Haz búsquedas en Google con una imagen en lugar de utilizar texto.
Fresh air and monkey droppings	Aroma a aire fresco y excrementos de mono
The image must be in .jpg, .gif, .png, or .bmp format.	El formato de la imagen debe ser .jpg, .gif, .png o .bmp.
Significant delays at this station.	Hay retrasos importantes en esta estación.
Labeled for noncommercial reuse	Etiquetadas para reutilización no comercial
See up-to-date traffic conditions to help you plan your route.	Ve las condiciones de tráfico actualizadas, que te ayudarán a planificar tu ruta.
allow some forms of re-use	admitan algún tipo de reutilización
Add movie showtimes to iGoogle	Añadir los horarios de las películas a iGoogle
Screen reader users, click here to turn off advanced search features.	Los usuarios de lectores de pantalla deben hacer clic aquí para desactivar las funciones de búsqueda avanzada.
Return books with the author name	Mostrar libros según su autor
Google is neither affiliated with the authors of this page nor responsible for its content.	Google no tiene relación con los autores de esta página ni es responsable de su contenido.
Show weather conditions on the map.	Mostrar información meteorológica en el mapa
Does this place really exist?	¿Existe realmente este lugar?
This place may not exist	Es posible que este lugar no exista.
The display size of image is determined by browser window size.	El tamaño de visualización de la imagen viene determinado por la ventana del navegador.
Not satisfied? See results for:	¿No quedó satisfecho? Vea los resultados de:
Make sure all your points are located on a roadway	Asegúrate de que todos los puntos que introdujiste se encuentren en la calzada
The information below may reflect earlier edits, but the map has not yet been updated.	Es posible que la siguiente información refleje cambios anteriores, pero todavía no se ha actualizado el mapa.
See all posts in this blog	Ver todas las entradas de este blog
Try an alternate number?	¿Quieres probar con un número alternativo?
Click to confirm this request:	Haz clic aquí para confirmar esta solicitud:
Find pages that link to the page	Encontrar páginas que enlazan a la página
Some of our search results can be offensive.	Algunos resultados pueden ser ofensivos.
You can view and edit this map atVIEW_MAP_URL	Puede ver y editar este mapa en VIEW_MAP_URL
Is there wrong information but you don't know enough to correct it?	¿Hay información errónea pero no sabes cómo corregirla?
Sorry, we are undergoing maintenance, but please come back later.	Lo sentimos, actualmente estamos realizando tareas de mantenimiento. Por favor, vuelve más tarde.
Couldn't find anything to save!	No hay elementos para guardar.
Go back to the Google home page	Volver a la página principal de Google
Remove from starred images	Eliminar de imágenes destacadas
More results from this patent	Más resultados de esta patente
Know about this place and want everyone to find it?	¿Conoces este lugar y quieres que todo el mundo lo pueda encontrar?
Sorted by date with duplicates included	Ordenados por fecha, incluyendo duplicados
Return books published by	Mostrar libros publicados por
Stand on the shoulders of giants	A hombros de gigantes
Report inappropriate PHOTO_LINK_STARTphotoPHOTO_LINK_END | VIDEO_LINK_STARTvideoVIDEO_LINK_END	Informar acerca de una PHOTO_LINK_STARTfotografíaPHOTO_LINK_END o un VIDEO_LINK_STARTvídeoVIDEO_LINK_END inadecuados
Dissatisfied? See results for:	¿No está satisfecho? Consulte los resultados de:
Trying to preview mobile ads? Click OPEN_LINK_TO_MOBILE_AD_TESThereCLOSE_LINK_TO_MOBILE_AD_TEST.	¿Intentas obtener una vista previa de anuncios para móviles? Haz clic OPEN_LINK_TO_MOBILE_AD_TESTaquíCLOSE_LINK_TO_MOBILE_AD_TEST.
This will delete any reviews and stars you have added to this place.	Se eliminarán las reseñas
Which step mentions the problem?	¿En qué paso se menciona el problema?
Add to starred images.	Añadir a imágenes destacadas
Top results sorted by date	Resultados principales ordenados por fecha
Too many locations found in import file.	Se han encontrado demasiadas ubicaciones en el archivo de importación.
Significant problems, difficult or impossible to read	Con problemas importantes; difícil o imposible de leer
All route waypoints will get sent.	Se enviarán todos los hitos de la ruta.
Do not filter my search results.	Dejar sin filtrar los resultados de mi búsqueda.
Link to this page	Enlazar con esta página
Choose a suggestion or try being less specific.	Selecciona una sugerencia o intenta ser menos específico.
Tips for writing a public response	Sugerencias para redactar una respuesta pública
Or drag the marker to the primary entrance of this place.	O arrastra el marcador a la entrada principal de este lugar.
Leaving the page will stop the verifying process now in progress. Leave this page?	Al salir de la página, se detendrá el proceso de verificación. ¿Seguro que quieres salir?
Click to start drawing a line	Haz clic para empezar a dibujar una línea.
Wet, tangy, misty and muggy dew	Aroma a rocío húmedo, ácido y brumoso
Paste link in BOLD_TAG_STARTemailBOLD_TAG_END or BOLD_TAG_STARTIMBOLD_TAG_END	Pegar enlace en BOLD_TAG_STARTmensaje de correo electrónicoBOLD_TAG_END o BOLD_TAG_STARTmensaje instantáneoBOLD_TAG_END
Try the new map editor - Learn more	Prueba el nuevo editor de mapas. Más información
Open search results in a new browser window.	Mostrar los resultados de la búsqueda en una nueva ventana de navegador.
Starred images from Google	Imágenes destacadas de Google
Get the latest Flash Player.	Consigue la última versión de Flash Player.
More results from this book	Más resultados de este libro
Search public source code	Búsqueda de código fuente público
Click to drop a pin	Haz clic para soltar una chincheta
