Images may be subject to copyright.	Las imágenes pueden estar protegidas por derechos de autor.
Try more general keywords.	Intenta usar palabras más generales.
Make sure all words are spelled correctly.	Comprueba que todas las palabras están escritas correctamente.
Click for video information	Haz clic para ver la información en vídeo
Click for product information	Haz clic para ver la información sobre el producto
Check website for latest pricing and availability.	Accede al sitio web para consultar la disponibilidad y el precio más reciente.
Tap and hold to copy link	Mantén pulsado el enlace para copiarlo
Tap to copy link	Toca para copiar el enlace
Looks like this collection is empty	Parece que esta colección está vacía
Bring back cards you removed	Recuperar las tarjetas que has quitado
Stop seeing certain cards	Dejar de ver determinadas tarjetas
Anyone with the link can see this collection	Cualquier usuario que tenga el enlace puede ver esta colección.
Only you can see this collection	Solo tú puedes ver esta colección.
Tap a match to see player stats	Toca un partido para ver estadísticas de los jugadores
Failed to change your settings. Try again later.	No se ha podido cambiar tu configuración. Inténtalo de nuevo más tarde.
To get alerts, notifications should be turned on in both Google app and device settings.	Para recibirlas, las notificaciones deben estar activadas en la aplicación de Google y en la configuración del dispositivo.
Keep your Google Account secure: Get real-time security alerts directly on your device.	Protege tu cuenta de Google: recibe directamente en tu dispositivo alertas de seguridad en tiempo real.
Unfollowing will remove this collection from your list of collections.	Si dejas de seguir esta colección, se quitará de tu lista de colecciones.
Full time · See stats, news, and more	Fin del partido · Consulta estadísticas, noticias y mucho más
Send us your video content	Envíanos tu contenido de vídeo.
Harness the power of GIFs to reach an engaged audience of 350M+ people.	Aprovecha el potencial de los GIF para llegar a una audiencia participativa de más de 350 millones de personas.
Only you can see your personal results.	Solo tú puedes ver el contenido personal.
To include an app in search results, tap it again.	Para incluir una aplicación en los resultados de búsqueda, tócala de nuevo.
How your app info stays private	Por qué la información de las aplicaciones sigue siendo privada
To remove an app from search results, tap it.	Si quieres quitar una aplicación de los resultados de búsqueda, tócala.
When you search in apps on your phone, you can see:	Cuando haces búsquedas en las aplicaciones de tu teléfono, puedes ver lo siguiente:
In the search box, type what you’re looking for.	En el cuadro de búsqueda, escribe tu consulta.
Tap the language you want to view the translation.	Toca el idioma en el que quieras ver la traducción.
This field is required.	Este campo es obligatorio.
Sign in to save jobs	Para guardar ofertas de trabajo, inicia sesión
Only you and your parent can see this data. Google protects your privacy and security.	Solamente tú y tus padres podéis ver estos datos. Google protege tu privacidad y seguridad.
Only you can see this data. Google protects your privacy and security.	Solo tú puedes ver estos datos. Google protege tu privacidad y seguridad.
Search business class flights	Buscar vuelos en clase business
Send feedback to Google	Envía comentarios a Google
Related to your search	Relacionados con tus búsquedas
Unable to share collection. Please check your popup blocker.	No se ha podido compartir la colección. Comprueba el estado de tu bloqueador de ventanas emergentes.
Sao Tome and Principe	Santo Tomé y Príncipe
Saint Kitts and Nevis	San Cristóbal y Nieves
Saint Pierre and Miquelon	San Pedro y Miquelón
Bonaire, Sint Eustatius, and Saba	Bonaire, San Eustaquio y Saba
My SafeSearch setting keeps turning off	La función Búsqueda Segura se desactiva sola
If you allow cookies, SafeSearch should stay on.	Si permites las cookies, Búsqueda Segura debería permanecer activada.
Block explicit results on Google using SafeSearch	Bloquear resultados con contenido explícito en Google mediante Búsqueda Segura
Find widgets on Google Play	Buscar widgets en Google Play
Notices about Filtered Results	Avisos sobre resultados filtrados
A label showing the percentage change in price.	Etiqueta en la que se muestra el porcentaje de cambio en el precio.
This reminder has been deleted. Please refresh the browser to view the updated list.	Se ha eliminado este recordatorio. Actualiza el navegador para ver la lista modificada.
From your Gmail reservation	De tu reserva de Gmail
You can delete all of this data or change this setting.	Puedes eliminar todos estos datos o cambiar el ajuste.
Select one from the following list of service providers	Selecciona una opción de la siguiente lista de proveedores de servicios
Google Search Page Header	Encabezado de la página de la Búsqueda de Google
Search for a company or symbol	Buscar una empresa o un símbolo
Keep track of your watchlist and watch how it performs	Controla tu lista de seguimiento y observa cómo evoluciona
Unable to share collection	No se puede compartir la colección
Stories must be a least four pages	Las noticias deben tener al menos cuatro páginas
Final · See stats, news, and more	Finalizado · Consulta estadísticas, noticias y mucho más
Get it on Google Play	Descargar de Google Play
Data shared for research	Datos compartidos para la investigación
See and delete your preferences about News.	Consulta y elimina tus preferencias de Noticias.
Manage music you’ve identified with the Sound Search widget.	Gestiona la música que hayas identificado con el widget Sound Search.
View YouTube Community posts	Ver publicaciones de la comunidad de YouTube
Manage Google Play Sound Search History	Gestionar el historial de Sound Search de Google Play
Google Play Sound Search History	Historial de Sound Search de Google Play
Comments on YouTube Community posts	Comentarios en publicaciones de la comunidad de YouTube
Comments on YouTube videos	Comentarios en vídeos de YouTube
See and delete your answers to survey questions from Google.	Consulta y elimina tus respuestas a encuestas de Google.
Teams and leagues you follow	Equipos y ligas que sigues
A performance comparison of financial entities, composed of table and chart.	Una comparación del rendimiento de entidades financieras que incluye una tabla y un gráfico.
A table showing the prices at the selected time point in the chart.	Una tabla que muestra los precios en el periodo seleccionado en el gráfico.
Your answers will improve Search for other people. Learn more.	Tus respuestas ayudan a mejorar la Búsqueda para todos los usuarios. Más información
You suggested this change. Edit?	Esta es tu sugerencia. ¿Quieres cambiarla?
Improve the language on this page	Mejorar los textos en este idioma
Manage your Google Tag Manager container versions	Administrar las versiones de tus contenedores de Google Tag Manager
View monetary and non-monetary YouTube Analytics reports for your YouTube content	Ver informes económicos y no económicos de YouTube Analytics de tu contenido de YouTube
View YouTube Analytics reports for your YouTube content	Permite ver informes de YouTube Analytics sobre su contenido de YouTube.
View your Google Tag Manager container and its subcomponents	Consultar tu contenedor de Google Tag Manager y sus subcomponentes
Manage user permissions of your Google Tag Manager account and container	Administrar los permisos de los usuarios de tu cuenta y contenedor de Google Tag Manager
Publish your Google Tag Manager container versions	Publicar las versiones de tu contenedor de Google Tag Manager
View and manage creatives and campaigns for DoubleClick Studio	Permite visualizar y administrar creatividades y campañas de DoubleClick Studio.
Delete your Google Tag Manager containers	Eliminar tus contenedores de Google Tag Manager
View creatives and campaigns for DoubleClick Studio	Permite visualizar creatividades y campañas de DoubleClick Studio.
View and manage your Google Tag Manager accounts	Consultar y administrar tus cuentas de Google Tag Manager
Tap a match to see scores, stats, and more	Toca un partido para ver resultados, estadísticas y mucho más
Type a name, phone, or email	Nombre, teléfono o correo
This site may be hacked.	Este sitio web puede haber sido pirateado.
Update your featured image on Search	Actualiza tu imagen destacada en la Búsqueda
Saved items will be added to this collection	Los elementos guardados se añadirán a esta colección
Open in Google Podcasts	Abrir en Podcasts de Google
Your Site on Google	Tu sitio web en Google
Your activity, while you were signed in to Google.	Tu actividad con la sesión iniciada en tu cuenta de Google.
Add a Finance shortcut to your Home screen	Añade un acceso directo de Finance a tu pantalla de inicio
How your saved activity is used	Cómo se utiliza tu actividad guardada
To let Google save this information:	Para permitir que Google guarde esta información:
Your Chrome browsing history	Tu historial de navegación de Chrome
Information on your device like recent apps or contact names you searched for	Información sobre tu dispositivo, como aplicaciones recientes o nombres de contacto que has buscado
See or delete your search activity	Ver o eliminar la actividad de búsqueda
*Not all languages are supported.	* No todos los idiomas están disponibles.
Therefore, these pages are no longer accessible from Google search.	Por lo tanto, ya no es posible acceder a ellas desde una búsqueda en Google.
Watch the most memorable moments of the tournament	Mira los momentos más memorables del torneo
Add a missing place to Google Maps.	Añadir un sitio que falta a Google Maps
Lifetime on most items	Permanente para la mayoría de los artículos
Tin Tan’s 103rd Birthday	103.º aniversario del nacimiento de Tin Tan
Professor Dorothy Hill’s 111th Birthday	111.º aniversario del nacimiento de la profesora Dorothy Hill
Josefa Llanes Escoda’s 120th Birthday	120.º aniversario del nacimiento de Josefa Llanes Escoda
Junko Tabei’s 79th Birthday	79.º aniversario del nacimiento de Junko Tabei
Joanna Baillie’s 256th Birthday	256.º aniversario del nacimiento de Joanna Baillie
Fatima Surayya Bajia’s 88th Birthday	88.º aniversario del nacimiento de Fatima Surayya Bajia
your One Drive account	tu cuenta de OneDrive
Caio Fernando Abreu’s 70th Birthday	70.º aniversario del nacimiento de Caio Fernando Abreu
Initiated a bulk download from Drive	Se ha iniciado una descarga en bloque en Drive
We are sorry, the service is currently unavailable. Please verify your internet connection and try again.	El servicio no está disponible en estos momentos. Comprueba tu conexión a Internet e inténtalo de nuevo.
Sent to Google Home	Se ha enviado a Google Home
Send to Google Home	Enviar a Google Home
Compare to another index	Comparar con otro índice
Compare to another stock	Comparar con otra acción
Next to each stock you want to follow, tap or click the box.	Toca o haz clic en las casillas de las acciones que quieras seguir.
Voice search results come in the same language as your voice search.	Los resultados de la búsqueda por voz se obtienen en el mismo idioma que utilizas para la búsqueda por voz.
Pick the language for your search results.	Puedes elegir el idioma en el que quieres ver tus resultados de búsqueda.
At the top left, tap your photo.	En la parte superior izquierda, toca tu foto.
Tap a category to see options and make changes.	Tocar una categoría para ver las opciones correspondientes y realizar cambios.
At the top left, tap your photo.	En la parte superior izquierda, toca tu foto.
You can turn these video previews on or off, and change when they play.	Puedes activar o desactivar estas vistas previas de vídeos y cambiar cuándo se reproducen.
Videos in your feed could start playing automatically without sound.	Los vídeos de tu tablón pueden empezar a reproducirse automáticamente sin sonido.
Videos could start playing automatically without sound.	Los vídeos pueden empezar a reproducirse automáticamente sin sonido.
Press the Home button.	Pulsa el botón de inicio.
Replace all existing events	Sustituir todos los eventos
Import from Google Sheets	Importar de Hojas de cálculo de Google
This image may be subject to copyright.	Esta imagen puede estar sujeta a derechos de autor.
Sergey Prokudin-Gorsky’s 155th Birthday	155.º aniversario del nacimiento de Sergey Prokudin-Gorsky
Viola Desmond’s 104th Birthday	104.º aniversario del nacimiento de Viola Desmond
Mehdi Hassan’s 91st Birthday	91.º aniversario del nacimiento de Mehdi Hassan
Leonard Bernstein’s 100th Birthday	100.º aniversario del nacimiento de Leonard Bernstein
José Emilio Pacheco’s 79th Birthday	79.º aniversario del nacimiento de José Emilio Pacheco
Prasanta Chandra Mahalanobis’ 125th Birthday	125.º aniversario del nacimiento de Prasanta Chandra Mahalanobis
Meena Kumari’s 85th Birthday	85.º aniversario del nacimiento de Meena Kumari
Prayoon Yommium’s 85th Birthday	85.º aniversario del nacimiento de Prayoon Yommium
Pumpuang Duangjan’s 57th Birthday	57.º aniversario del nacimiento de Pumpuang Duangjan
Dilip Sardesai’s 78th Birthday	78.º aniversario del nacimiento de Dilip Sardesai
Gerda Taro’s 108th Birthday	108.º aniversario del nacimiento de Gerda Taro
Gauhar Jaan’s 145th Birthday	145.º aniversario del nacimiento de Gauhar Jaan
Reload as optimized page	Volver a cargar como página optimizada
Carmen Conde’s 111th Birthday	111.º aniversario del nacimiento de Carmen Conde
Sort by personal match	Ordenar por coincidencia personal
Hourly, humidity, wind and more	Hora, humedad, viento y más
See stocks you’re following	Ver las acciones que sigues
Tap an upcoming reminder.	Toca un recordatorio próximo.
Note that these changes may not appear on all Google Searches.	Recuerda que es posible que estos cambios no aparezcan en todas las búsquedas de Google.
The end date must be after the start date.	La fecha de finalización debe ser posterior a la fecha de inicio.
Replace all existing events?	¿Quieres sustituir todos los eventos?
The title must have at least one letter or numeric character.	El título debe tener al menos una letra o un número.
Paste the link to your Google spreadsheet here and your events will be imported.	Pega aquí el enlace a tu hoja de cálculo de Google y se importarán tus eventos.
This event will be permanently deleted and cannot be recovered.	Este evento se eliminará permanentemente y no se podrá recuperar.
is missing one or more required field	no tiene uno o varios de los campos requeridos
has an invalid start time or date	tiene una fecha u hora de inicio no válida
has an invalid end time or date	tiene una fecha u hora de finalización no válida
This search is trending in your area.	Esta búsqueda se está volviendo popular en tu zona.
Start repeating Morse symbol after	Empezar a repetir el símbolo en morse después de
Talal Maddah’s 78th Birthday	78.º aniversario del nacimiento de Talal Maddah
Sergey Prokudin-Gorsky’s 155th birthday	155.º aniversario del nacimiento de Sergey Prokudin-Gorsky
Prayoon Yommium’s 85th birthday	85.º aniversario del nacimiento de Prayoon Yomyiam
Pumpuang Duangjan’s 57th birthday	57.º aniversario del nacimiento de Pumpuang Duangjan
Marga Faulstich’s 103rd Birthday	103.º aniversario del nacimiento de Marga Faulstich
Meena Kumari’s 85th birthday	85.º aniversario del nacimiento de Meena Kumari
Leonard Bernstein’s 100th birthday	100.º aniversario del nacimiento de Leonard Bernstein
Gerda Taro’s 108th birthday	108.º aniversario del nacimiento de Gerda Taro
Dilip Sardesai’s 78th birthday	78.º aniversario del nacimiento de Dilip Sardesai
Celebrating Johann Sebastian Bach	Homenaje a Johann Sebastian Bach
Carmen Conde’s 111th birthday	111.º aniversario del nacimiento de Carmen Conde
85th Anniversary of Biskupin settlement discovery	85.º aniversario del descubrimiento del asentamiento de Biskupin
197th Anniversary of Zugspitze first ascent	197.º aniversario de la primera ascensión del Zugspitze
People who liked this also like	A los usuarios a los que les gusta esto también les gusta
Customize cards in your feed	Personalizar el Tablón de la aplicación de Google
From the top left, tap your profile picture.	En la esquina superior izquierda, toca tu foto de perfil.
Choose the day or date range.	Elige el día o el periodo que quieras eliminar.
You may be asked to sign in to your Google Account.	Puede que tengas que iniciar sesión con tu cuenta de Google.
What info is saved in your feed activity	¿Qué información se guarda en la actividad de tu tablón?
Which cards you view, swipe away, or hide	Las tarjetas que consultas, deslizas u ocultas
The cards and results that appeared in your feed	Las tarjetas y los resultados que se muestran en tu tablón
The device you use to access your feed	El dispositivo que utilizas para acceder a tu tablón
You can get more helpful cards and search results from your feed activity.	A partir de la actividad de tu tablón, Google puede mostrarte tarjetas y resultados de búsqueda más útiles.
Would you like to leave feedback about your call?	¿Quieres hacernos llegar tus comentarios sobre la llamada?
Featured snippet from the web	Fragmento destacado de la Web
Video featured snippet from the web	Fragmento destacado de vídeo de la Web
Unable to hide this card. Please try again later.	No se ha podido ocultar esta tarjeta. Vuelve a intentarlo más tarde.
Try an optimized page.	Prueba con una página optimizada.
Try again in a few minutes.	Vuelve a intentarlo en unos minutos.
No theaters near the selected location.	No hay ningún cine cerca de la ubicación seleccionada.
Create or delete a reminder	Crear o eliminar un recordatorio
sergej milinkovic-savic news	noticias sobre sergej milinkovic-savic
hannes thór halldórsson news	noticias sobre hannes thór halldórsson
Changes in network conditions	Cambios en el estado de la red
Results can vary for many reasons, like:	Los resultados pueden variar por muchas razones, por ejemplo:
The best internet connections have high download and upload speeds but low latency.	Con las mejores conexiones a Internet, las velocidades de subida y de descarga son altas y la latencia es baja.
Why your test results could vary	Por qué pueden variar los resultados de la prueba
There are a few ways you can create a reminder in the Google app:	Hay varias formas de crear recordatorios en dicha aplicación:
Provide the following to publish this event	Proporciona la siguiente información para publicar este evento
Say "Ok Google" to start a voice search.	Di "Ok Google" para iniciar una búsqueda por voz.
Search without lifting a finger. When you say "Ok Google," Chrome will search for what you say next.	Busca sin mover un dedo. Di "Ok Google" y Chrome buscará lo que digas a continuación.
Listening for "Ok Google"	Esperando escuchar "Ok Google"
Improve voice search by sending the sound of "Ok Google," and a few seconds before, to Google.	Mejora la búsqueda por voz enviando el sonido de "Ok Google" y el de unos segundos antes de decirlo a Google.
To get started, set up "Ok Google" on your device.	Para empezar, configura "Ok Google" en tu dispositivo.
To change these times:	Para cambiar este tiempo:
You can pause, move forward or back, change speed, and shorten silences.	Puedes pausarlo, avanzar o retroceder, cambiar la velocidad y acortar los silencios.
By default, Google Podcasts removes downloaded episodes:	De manera predeterminada, Podcasts de Google borra los episodios descargados:
Change when downloads are removed	Cambiar cuándo se quitan las descargas
Find an episode of a subscribed podcast	Buscar episodios de podcasts a los que te has suscrito
Play an episode of a podcast	Reproducir episodios de podcasts
On your Android phone or tablet, you can:	En tu teléfono o tablet Android, puedes:
You can see your subscriptions at the top of Google Podcasts.	Puedes ver tus suscripciones en la parte superior de la aplicación Podcasts de Google.
Listen to podcasts on Google Home	Escuchar podcasts en Google Home
Cast podcasts to Chromecast Audio	Enviar podcasts a Chromecast Audio
Listen to podcasts with Google Podcasts	Escuchar podcasts con Podcasts de Google
Turn off ads from this advertiser	Desactivar los anuncios de este anunciante
Add your favorite stocks for quick access and to stay in know with the latest financial news.	Añade tus acciones favoritas para poder acceder a ellas rápidamente y estar al tanto de las últimas noticias financieras.
Recommendation , featured, storage, shows, episodes, playback speed, offline listening, trim silence	Recomendación, destacado, almacenamiento, programas, episodios, velocidad de reproducción, escuchar sin conexión, recortar silencio
Subscribe to podcasts and get the latest episodes	Suscríbete a podcasts y recibe los episodios más recientes.
You can listen and download any podcast you’ve heard of anywhere, anytime for free.	Puedes escuchar y descargar cualquier podcast del que hayas oído hablar en cualquier lugar y momento gratuitamente.
Trim silence to cut silences from episodes so you finish them faster, saving hours	Recorta los silencios de los episodios para terminar de escucharlos antes y ahorrar tiempo.
Listen to podcasts at your preferred playback speed with the variable speed feature.	Escucha podcasts a la velocidad que prefieras con la función de velocidad variable.
Safely manage your podcast subscriptions with cloud storage.	Gestiona de forma segura tus suscripciones a podcasts con el almacenamiento en la nube.
Listen on all your devices	Escucha podcasts en todos tus dispositivos
Listen to the same podcast on multiple devices without losing your place.	Escucha el mismo podcast en varios dispositivos sin que se pierda la posición por donde ibas.
Pause on your phone and pick up where you left off on your Google Home.	Pausa la reproducción en tu teléfono y continúa en tu Google Home desde el mismo punto.
Receive the latest episodes of your favorite podcasts directly on your phone.	Recibe los últimos episodios de tus podcasts favoritos directamente en tu teléfono.
Google Podcasts is a new way for Android users to discover and listen to any podcast.	Podcasts de Google es una nueva forma de descubrir y escuchar podcasts en Android.
Listen to podcasts at faster playback speeds or skip over silences.	Escucha podcasts a velocidades de reproducción más altas o sáltate los silencios.
Find the latest episodes of your favorite podcasts directly on your phone.	Encuentra los últimos episodios de tus podcasts favoritos directamente en tu teléfono.
Google Podcasts is a new way for Android users to discover and listen to the world’s podcasts.	Podcasts de Google es una nueva forma de descubrir y escuchar podcasts de todo el mundo en Android.
You can subscribe to any show for free and download episodes for offline listening.	Puedes suscribirte gratuitamente a cualquier programa y descargar episodios para escucharlos sin conexión.
Anyone with this link can see your collection	Los usuarios que tengan este enlace podrán ver tu colección
Turn offline search on or off	Activar o desactivar las búsquedas offline
See or remove searches	Ver o quitar búsquedas
You've helped others make better decisions about places to go	Has ayudado a los demás a decidir mejor a qué sitios ir.
You've helped others make better decisions about places to go.	Has ayudado a otras personas a tomar mejores decisiones acerca de los sitios que pueden visitar.
Failed to move selected items. Try again later.	No se han podido mover los elementos seleccionados. Vuelve a intentarlo más tarde.
Hide name and show number to others	Ocultar el nombre y mostrar el número a otros usuarios
Failed to remove collection. Try again later.	No se ha podido quitar la colección. Vuelve a intentarlo más tarde.
No targets to send to for this input.	No hay destinos para enviar para esto.
All items in this collection will be removed.  Are you sure you want to remove this collection?	Se quitarán todos los elementos de esta colección. ¿Seguro que quieres quitarla?
Type any email address	Escribe cualquier dirección de correo electrónico
Failed to create collection. Try again later.	No se ha podido crear la colección. Vuelve a intentarlo más tarde.
Type a name or email	Escribe un nombre o un correo electrónico
Only editable in Maps	Solo se puede editar en Maps
Edit collection in Maps	Editar colección en Maps
Failed to rename collection. Try again later.	No se ha podido cambiar el nombre de la colección. Vuelve a intentarlo más tarde.
Failed to delete selected items. Try again later.	No se han podido eliminar los elementos seleccionados. Vuelve a intentarlo más tarde.
To make sharing easier, Google suggests people to share with based on your interactions	Google te ayuda a compartir contenido de manera más sencilla sugiriéndote personas a quien enviárselo en función de tus interacciones
Access sports in one tap	Accede a los deportes con un solo toque
Get back here in one tap	Accede aquí con un solo toque
Add a shortcut to sports	Añade un acceso directo a los deportes
Is there flood damage around you?	¿Hay daños por la inundación a tu alrededor?
Do you see earthquake damage around you?	¿Ves daños por el terremoto a tu alrededor?
See results in English	Ver resultados en inglés
You looked this up	Lo que has buscado
