Record raw signal data for Moma Search Signal Hub	Registrar datos de señales sin procesar para el centro de señales de la búsqueda Moma
Publish cards to Moma Now	Publicar tarjetas en Moma Now
Access the Virtual Cluster service	Acceder al servicio de Virtual Cluster
View and manage Apps storage quota data	Ver y administrar los datos de cuotas de almacenamiento de Google Apps
Access the InStore Wallet Partner Service	Acceder al servicio de InStore Wallet Partner
View and manage guardians for students in your Google Classroom classes	Ver y administrar los tutores de los estudiantes de tus clases de Google Classroom
Manage the apps that are shown in your channel.	Administrar las aplicaciones que se muestran en tu canal.
View your Google Classroom guardians	Ver tus tutores de Google Classroom
Read and update TeamConnect data	Leer y actualizar datos de TeamConnect
View the activity history of your Google Apps	Ver el historial de actividad de tus aplicaciones de Google Apps
View and manage your headcount data	Ver y administrar los datos del personal
View instructions for teacher-assigned work in your Google Classroom classes	Ver las instrucciones de los trabajos asignados por los profesores en tus clases de Google Classroom
View the email addresses of people in your classes	Ver las direcciones de correo electrónico de las personas de tus clases
View the profile photos of people in your classes	Ver las fotos de perfil de las personas de tus clases
Manage your course work and view your grades in Google Classroom	Administrar tus trabajos de cursos y ver tus notas en Google Classroom
View your Google Classroom class rosters	Ver las listas de tus clases de Google Classroom
View and manage your Study Kit data	Ver y administrar tus datos de Study Kit
View your Google Classroom classes	Ver tus clases de Google Classroom
Manage your Google Classroom data	Administrar tus datos de Google Classroom
Manage your Google Classroom class rosters	Administrar las listas de tus clases de Google Classroom
Manage your Study Kit device	Administrar tu dispositivo de Study Kit
Manage your Google Classroom classes	Administrar tus clases de Google Classroom
Connect to Google Login Manager	Conectarse al administrador de inicios de sesión de Google
Search your content across Google Apps	Realizar búsquedas en tu contenido de los diferentes servicios de Google Apps
Search your Google Apps for Work content	Realizar búsquedas en tu contenido de Google Apps for Work
Search content on your Google Search Appliance	Realizar búsquedas en tu contenido de Google Search Appliance
Access and manage all your Weave devices	Acceder a todos tus dispositivos de Weave y administrarlos
Connect to Google Open Gallery	Conectar con Google Open Gallery
Access and manage your authorized Weave devices	Acceder a tus dispositivos de Weave autorizados y administrarlos
Search and manage data in Cloud Search	Buscar y administrar datos de Cloud Search
Manage your cloud devices	Administrar tus dispositivos en la nube
Securely connect your device to devices nearby	Conectar de forma segura tu dispositivo a dispositivos cercanos
View and manage the state of contact center calls	Ver y administrar el estado de las llamadas del centro de contactos
View and manage your Wildfire data	Ver y administrar tus datos de Wildfire
Access Google Fiber network management data	Acceder a los datos de administración de red de Google Fiber
Provide confirmations using your mobile device	Enviar confirmaciones mediante tu dispositivo móvil
Access Cloud devices with this application	Acceder a dispositivos en la nube con esta aplicación
View your Google Partners information	Ver la información de tus Google Partners
View log data for your projects	Ver datos de registro de tus proyectos
Administrate log data for your projects	Administrar datos de registro de tus proyectos
Submit log data for your projects	Enviar datos de registro de tus proyectos
Publish metric data to your Google Cloud projects	Publicar datos de métricas en tus proyectos de Google Cloud
View monitoring data for all of your Google Cloud and third-party projects	Ver los datos de supervisión de todos tus proyectos de Google Cloud y de terceros
Import your Songza playlists and song votes into Google Play Music	Importar tus listas de reproducción y votos de canciones de Songza en Google Play Música
View and manage your cloud-enabled devices	Ver y administrar tus dispositivos habilitados para la nube
View the tiles of Google Maps	Ver los mosaicos de Google Maps
View and manage your Google Places data	Ver y administrar tus datos de Google Places
View and manage Search Console data for your verified sites	Ver y administrar los datos de Search Console de tus sitios web verificados
View Search Console data for your verified sites	Ver los datos de Search Console de tus sitios web verificados
View and manage customer related information	Ver y administrar información relacionada con los clientes
Access the Google Books frontend	Acceder a la interfaz de Google Libros
View and manage the files in Google Drive for all users in your domain	Ver y administrar los archivos de Google Drive para todos los usuarios de tu dominio
View and manage metadata of files in your Google Drive	Ver y administrar los metadatos de los archivos que tienes en Google Drive
View and manage Google Drive files and folders that you have opened or created with this app	Ver y administrar los archivos y carpetas de Google Drive que has abierto o creado con esta aplicación
View metadata for files in your Google Drive	Ver los metadatos de los archivos que tienes en Google Drive
View and manage the files in your Google Drive	Ver y administrar los archivos que tienes en Google Drive
View and manage Google Express Operations data	Ver y administrar los datos de Google Express Operations
View and manage Techstop Toolbox information	Ver y administrar la información de Techstop Toolbox
View your Chrome Web Store apps and extensions	Ver tus aplicaciones y extensiones de Chrome Web Store
Manage Google Express order fulfillment data	Administrar datos de procesamiento de pedidos de Google Express
View and manage sameday return	Ver y administrar la devolución de Sameday
View Techstop Toolbox information	Ver la información de Techstop Toolbox
Send app usage reports to Google Shopping Express	Enviar informes de uso de las aplicaciones a Google Shopping Express
View and manage your Chrome Web Store apps and extensions	Ver y administrar tus aplicaciones y extensiones de Chrome Web Store
View and manage sameday refund	Ver y administrar el reembolso de Sameday
View Mail - CC Recipient Addresses using Gmail Contextual Gadget	Ver las direcciones de los destinatarios del correo en Cc mediante el gadget contextual de Gmail
View Mail - Sender Address using Gmail Contextual Gadget	Ver la dirección del remitente del correo mediante el gadget contextual de Gmail
View Mail - CC Recipient Names using Gmail Contextual Gadget	Ver los nombres de los destinatarios del correo en Cc mediante el gadget contextual de Gmail
View Mail - Mailing List Unsubscribe using Gmail Contextual Gadget	Ver la información para cancelar la suscripción a listas de distribución mediante el gadget contextual de Gmail
View Mail - Date Received using Gmail Contextual Gadget	Ver la fecha de recepción del correo mediante el gadget contextual de Gmail
View Mail - Date Sent using Gmail Contextual Gadget	Ver la fecha de envío del correo mediante el gadget contextual de Gmail
View and manage sameday marketing	Ver y administrar el marketing de Sameday
View Mail - BCC Addresses using Gmail Contextual Gadget	Ver las direcciones de los destinatarios del correo en Cco mediante el gadget contextual de Gmail
View Mail - Sender Name using Gmail Contextual Gadget	Ver el nombre del remitente del correo mediante el gadget contextual de Gmail
View Mail - Message Ids using Gmail Contextual Gadget	Ver los identificadores de mensajes de correo mediante el gadget contextual de Gmail
View Mail - Message Body using Gmail Contextual Gadget	Ver el cuerpo del mensaje del correo mediante el gadget contextual de Gmail
View Mail - To Recipient Addresses using Gmail Contextual Gadget	Ver las direcciones de los destinatarios del correo incluidas en el campo Para mediante el gadget contextual de Gmail.
View recent posts and comments from your Google+ stream	Ver las publicaciones y los comentarios recientes de tus novedades de Google+
View recent public posts and comments from your Google+ stream	Ver las publicaciones y los comentarios públicos recientes de tus novedades de Google+
View a list of your Google+ Collections	Ver una lista de tus colecciones de Google+
Insert data into Google BigQuery	Insertar datos en Google BigQuery
Manage your Google Service Control data	Administrar tus datos de control de servicios de Google
Manage alert polices for Google Cloud projects	Administrar políticas de alertas de proyectos de Google Cloud
Manage common device configuration resources for your domain	Administrar recursos de configuración de dispositivos comunes de tu dominio
View and manage entities in Unplugged	Ver y administrar entidades en Unplugged
Manage access to YouTube content for users in your domain	Administrar el acceso de los usuarios de tu dominio a los contenidos de YouTube
Send email on your behalf	Enviar correo electrónico en tu nombre
View emails you share with this app	Ver los correos electrónicos que compartes con esta aplicación
Manage your Google Play Music curated content	Administrar tu contenido seleccionado en Google Play Música
View Mail - Raw Subject Line using Gmail Contextual Gadget	Ver la línea del asunto del correo sin procesar mediante el gadget contextual de Gmail
Exchange content in realtime with members of your classroom	Intercambiar contenido en tiempo real con miembros de la clase
View and manage your Google My Maps data	Ver y administrar tus datos de Google My Maps
View your Google My Maps data	Ver tus datos de Google My Maps
View Mail - Subject Line using Gmail Contextual Gadget	Ver la línea del asunto del correo mediante el gadget contextual de Gmail
Reported by this computer	Notificada desde este ordenador
Reported by this tablet	Notificada desde este tablet
Your settings change has not been saved.	No se ha guardado el cambio realizado en tu configuración.
Typical response time is within a few hours.	El tiempo de respuesta habitual es de algunas horas.
Typical response time is within a few weeks.	El tiempo de respuesta habitual es de algunas semanas.
This business is available to message.	Puedes enviar un mensaje a esta empresa.
Typical response time is within a few days.	El tiempo de respuesta habitual es de algunos días.
Hotel deals for tonight	Ofertas de hotel esta noche
Add a logo that will appear with your posts	Añade el logotipo que se mostrará en tus publicaciones
Try again with a complete street address	Inténtalo de nuevo con una dirección postal completa
Mark review as helpful.	Marca esta reseña como útil.
Touch the inappropriate image on the search results page.	Toca la imagen inadecuada en la página de resultados de búsqueda.
Failed to update settings.	No se ha podido actualizar la configuración.
Failed to create post. Check your connection and try again.	Se ha producido un error al crear la entrada. Comprueba tu conexión e inténtalo de nuevo.
Brand your posts with your logo to establish authenticity and credibility	Marca tus entradas con tu logotipo para darles autenticidad y credibilidad
Will appear on search immediately	Aparecerá en la búsqueda inmediatamente
Cancel changes to time zone	Cancelar los cambios de la zona horaria
All fields are required	Todos los campos son obligatorios
More destinations on Google	Más destinos en Google
Search flight prices on Google	Buscar precios de vuelos en Google
Sonia Delaunay’s 131st birthday	131.º aniversario del nacimiento de Sonia Delaunay
Wadih El Safi’s 95th birthday	95.º aniversario del nacimiento de Wadih El Safi
Sir Frederick Banting’s 125th birthday	125.º aniversario del nacimiento de Sir Frederick Banting
Mary Seacole’s 211th birthday	211.º aniversario del nacimiento de Mary Seacole
Louisa May Alcott’s 184th birthday	184.º aniversario del nacimiento de Louisa May Alcott
Cecilia Grierson’s 157th birthday	157.º aniversario del nacimiento de Cecilia Grierson
Jagadish Chandra Bose’s 158th birthday	158.º aniversario del nacimiento de Jagadish Chandra Bose
Joe Hin Tjio’s 97th birthday	97.º aniversario del nacimiento de Joe Hin Tjio
Karimeh Abbud’s 123rd birthday	123.º aniversario del nacimiento de Karimeh Abbud
See where and when you can vote for the upcoming election on Google Search	Descubre dónde y cuándo puedes votar en las próximas elecciones en la Búsqueda de Google
Bang Jeong-hwan’s 117th birthday	117.º aniversario del nacimiento de Bang Jeong-hwan
Check the candidates on your national, state, and local ballots.	Consulta los candidatos de las papeletas nacionales, estatales y locales.
See how to vote for the upcoming national election on Google Search	Descubre cómo votar en las próximas elecciones nacionales en la Búsqueda de Google
See how to register for the national election on Google Search	Descubre cómo registrarte para las elecciones nacionales en la Búsqueda de Google
Lite Mode: Save data, search faster	Modo básico: ahorra datos, acelera las búsquedas
Lite Mode will be off, even if Google has detected that your connection is slow.	El modo básico estará inhabilitado aunque Google detecte que tu conexión es lenta.
Manage Lite Mode Settings	Administrar configuración del modo básico
Lite Mode will be enabled by default.	El modo básico se habilitará de forma predeterminada.
Choose location on map	Seleccionar en el mapa
Report content that requires removal under local laws	Informar sobre contenido que requiere ser eliminado de acuerdo con la legislación local
We’ll remind you again later	Te lo volveremos a recordar más tarde.
Register and manage devices in the Google Cloud IoT service	Registrar y administrar dispositivos en el servicio Google Cloud IoT
No prices available for this date	Precios no disponibles para esta fecha
In person ID requirements	Requisitos de identificación para votar en persona
By mail ID requirements	Requisitos de identificación para votar por correo
How to register to vote	Cómo inscribirse para votar
Sign in to your account.	Inicia sesión en tu cuenta.
Send a place from Google search results to your phone	Enviar un lugar de los resultados de búsqueda de Google al teléfono
Your activity on websites and in apps that use Google services.	Tu actividad en los sitios web y aplicaciones que utilizan los servicios de Google.
This information helps you see more accurate search results and suggestions.	Esta información te ayuda a ver sugerencias y resultados de búsqueda más precisos.
Your Chrome browsing history.	Tu historial de navegación de Chrome.
Activity from Chrome, websites, and apps	Actividad de Chrome, sitios web y aplicaciones
Polls closed, results expected soon	Colegios electorales cerrados; resultados disponibles en breve
If you’re using a browser, like Safari or Chrome, refresh the browser.	Si utilizas un navegador, como Safari o Chrome, actualízalo.
Results from your Google products are private.	Los resultados de tus productos de Google son privados.
To turn on Wi-Fi and choose a network:	Para activar la función Wi-Fi y seleccionar una red:
To turn on mobile data:	Para activar los datos móviles:
To turn off Airplane mode:	Para desactivar el modo avión:
Want more tips and tricks to help you search like a pro?	Si quieres obtener más consejos y trucos que te ayuden a hacer búsquedas como un profesional,
Editors' Choice on Google Play	Selección de nuestros expertos en Google Play
Drag and drop your Doodle here or	Arrastra y suelta el Doodle aquí o
Shop Fashion Week trends	Compra las tendencias de la semana de la moda
We were unable to connect with the merchant. Please try again.	No hemos podido conectar con el comerciante. Inténtalo de nuevo.
Typical response time is within few weeks.	El tiempo de respuesta habitual es de algunas semanas.
This business is available to chat.	Puedes chatear con este negocio.
Typical response time is within a few minutes.	El tiempo de respuesta habitual es de algunos minutos.
Typical response time is within few hours.	El tiempo de respuesta habitual es de algunas horas.
Typical response time is within a day.	El tiempo de respuesta habitual es inferior a un día.
Typical response time is within few days.	El tiempo de respuesta habitual es de algunos días.
Sensitive people should minimize outdoor activities and people with heart or lung disease should avoid such activities.	Las personas sensibles deberían minimizar las actividades en el exterior, y aquellas con enfermedades cardíacas o pulmonares deberían evitar este tipo de actividades.
Signature of Parent or Legal Guardian	Firma del padre, la madre o el tutor legal
Name of Parent or Legal Guardian	Nombre del padre, la madre o el tutor legal
View and manage your rental and purchase history.	Permite ver y administrar el historial de alquileres y compras.
View and manage your secure element data	Ver y administrar los datos de elementos seguros
View your Google+ posts, comments, and stream	Ver las publicaciones, los comentarios y las novedades de Google+
Manage and receive location based notifications	Administrar y recibir notificaciones en función de la ubicación
View and manage your Cloud Workflows	Consultar y administrar tus flujos de trabajo de Google Cloud
View your Google Voice data	Consulte sus datos de Google Voice.
View and manage your spreadsheets in Google Drive	Consulta y administra tus hojas de cálculo en Google Drive.
View and manage photo tours in Dragonfly	Permite visualizar y administrar recorridos fotográficos en Dragonfly.
View your Google Drive apps	Consulta tus aplicaciones de Google Drive.
View and manage your Supply Chain Portal operations	Ver y administrar operaciones del portal de cadena de suministros
View hiring data for reporting	Consulta datos de contratación para crear informes.
View and manage your Google Maps Coordinate jobs	Permite visualizar y administrar los trabajos de Google Maps Coordinate.
View and manage your access on Google Developers	Ver y gestionar el acceso a Google Developers
View your events-related data on developers.google.com	Permite consultar los datos relacionados con eventos en developers.google.com.
View and modify your beacons	Ver y modificar sus contadores
Checkin as consumer to the store	Registrarse como consumidor en la tienda
Retrieve travel availability data	Recuperar datos de disponibilidad de viajes
Add, modify, and remove workers	Permite añadir, modificar y eliminar a trabajadores
View and manage your Web History	Permite ver y administrar el historial web.
View and manage your workflow instances	Ver y administrar las instancias de tu flujo de trabajo
View project and task data	Permite visualizar datos de tareas y proyectos.
View and manage documents that this application has been installed in	Consulta y administra documentos en los que se ha instalado esta aplicación
View members of your circles	Consulta los miembros de tus círculos
View and manage carrier billing for Android devices	Permite visualizar y administrar la facturación al operador desde dispositivos Android.
View and manage Google+ settings	Permite ver y administrar la configuración de Google+.
View your Hangouts and media state	Permite ver tus conversaciones y el estado de los medios
Add questions and receive answers	Permite añadir preguntas y recibir respuestas
Access and manage Help Center content and other support data	Permite acceder al contenido del Centro de ayuda y a otros datos de asistencia, así como gestionarlos
View your Google Timepass entertainment data	Ver tus datos de entretenimiento de Google Timepass
View and manage your Travel information	Ver y administrar información sobre tus viajes
Manage your Chrome Sync data	Administre sus datos de sincronización de Chrome.
Manage the devices enrolled in Proximity Authentication	Administra los dispositivos que cuentan con autenticación de proximidad.
Manage your Google Voice data	Administre sus datos de Google Voice.
View and manage entries from your history of content recognized by the audio recognition service	Permite ver y administrar entradas del historial de contenido reconocidas por el servicio de reconocimiento de audio.
One-on-one and group conversations and video calls	Conversaciones y videollamadas privadas y en grupo
View your One Today activity	Consulta tu actividad de One Today.
View and manage your Google Cloud Datastore data	Permite ver y administrar los datos de Google Cloud Datastore.
View and manage your Google Cloud Messaging resources	Permite visualizar y administrar los recursos de la mensajería en la nube de Google.
View and manage data and metadata from Public Data Explorer	Consulta datos y metadatos de Public Data Explorer.
View and manage your Google Keep notes	Permite consultar y administrar tus notas de Google Keep
View and manage Chrome supervised users	Consulta y administra los usuarios supervisados de ​​Chrome
View and manage spreadsheets that this application has been installed in	Consulta y administra hojas de cálculo en las que se ha instalado esta aplicación
View and manage your data in Orgstore	Consulta y administra tus datos en Orgstore.
View and manage data associated with the application	Permite visualizar y administrar datos asociados a la aplicación.
Test scope for cookie access	Prueba de alcance para acceso de cookies
View and manage your Google Enterprise Support Cases	Permite ver y gestionar el Registro de consultas de Google Enterprise
View and manage forms that this application has been installed in	Consulta y administra formularios en los que se ha instalado esta aplicación
View and manage your verified name	Consulta y administra tu nombre verificado.
Manage your Tasks and Taskqueues	Administra tus tareas y tus colas de tareas.
View and manage your videoconference devices	Permite visualizar y administrar los dispositivos de videoconferencia
View and manage metadata about Google's partners	Permite visualizar y administrar los metadatos sobre los partners de Google
View and manage your Ad Exchange data	Consulta y administra datos de Ad Exchange.
Readonly access to user preferences	Permite tener acceso de solo lectura a las preferencias del usuario
View and manage chat conversations and user state	Permite visualizar y administrar conversaciones de chat y estados de usuario.
View and edit Google people information	Ver y modificar la información de personas de Google
View and manage your data in the Google ObjectStore service	Permite visualizar y administrar tus datos en el servicio Google ObjectStore.
View and manage your data across Google Cloud Platform services	Ver y administrar tus datos en los servicios de Google Cloud Platform
View your Google Coordinate jobs	Consulta los trabajos de Google Coordinate.
Manage the provisioning of referral domains	Administrar el aprovisionamiento de dominios de referencia
View your Google Cloud Datastore data	Consultar tus datos de Google Cloud Datastore
Manage your user profile and projects on Project Hosting	Administra tu perfil de usuario y tus proyectos en Google Project Hosting.
View and manage your data in ghost demo applications	Consulta y administra tus datos en las aplicaciones de prueba Ghost.
Configure shuttle stop regions	Permite configurar las regiones de las paradas de transporte
View and update in-store shopping inventory data	Ver y actualizar datos de inventario de compras en tienda
Moderate your Google+ posts, comments, and streams	Moderar tus novedades, comentarios y publicaciones de Google+
View and manage your photos inside Google+	Permite visualizar y administrar las fotos del usuario en Google+.
View and manage your Google Cloud Datastore Mobile data	Ver y administrar los datos del almacén de datos de Google Cloud para móviles
Access third party Glassware	Acceder a aplicaciones Glassware de terceros
View techstop data in Techstop Info	Consulta los datos de techstop en la información de Techstop.
Manage and grant your badges	Administra tus credenciales y ofrécelas.
View your Google Earth Engine data	Permite ver datos de Google Earth Engine.
View and manage Screenpop call notifications	Permite visualizar y administrar las notificaciones de llamadas de Screenpop.
View user activity information in Google+	Consultar la información de la actividad de usuario en Google+.
View data and metadata from Public Data Explorer	Consulta datos y metadatos de Public Data Explorer.
Access data for Hangouts-on-Air audience participation	Permite acceder a datos de la participación de la audiencia en Hangouts en directo
View your corporate legal data	Ver los datos jurídicos de tu empresa
View, manage and purchase Google Fiber video content	Permite visualizar, gestionar y comprar contenido de vídeos de Google Fiber.
Request payment from consumers for the merchant	Solicitar pago a los consumidores para el comerciante
Manage delivery information for all couriers	Administre la información de entregas de todos los mensajeros.
Manage your applications listed on the Google Apps Marketplace	Administre sus aplicaciones incluidas en Google Apps Marketplace.
View your Google Enterprise Support Cases	Permite ver el Registro de consultas de Google Enterprise
View and manage DoubleClick for Advertisers reports	Consulta y administra los informes de DoubleClick for Advertisers.
