Check your email for a confirmation link	Busca un enlace de confirmación en tu correo electrónico
Do you want me to delete all paired bluetooth devices?	¿Quieres que elimine todos los dispositivos Bluetooth vinculados?
Sorry, what would you like to change?	Lo siento, ¿qué es lo que quieres cambiar?
This condition typically has no symptoms	Esta enfermedad no suele tener síntomas
There was a problem processing your payment. Please try again using another payment method.	No se ha podido procesar tu pago. Inténtalo de nuevo con otro método de pago.
To change the list, swipe up on the message and choose another list.	Para cambiar de lista, desliza el dedo hacia arriba en el mensaje y elige otra.
What Google considers automated traffic	Qué es el tráfico automatizado para Google
Double tap to ask your assistant.	Toca dos veces para hablar con el Asistente.
You should see your changes in a few minutes	Podrás ver los cambios en unos minutos
Over time, it’ll become available in French, Japanese, and Portuguese.	Más adelante, estará disponible en francés, japonés y portugués.
After you create a bookmark, you can go to Google a few ways:	Cuando hayas creado un marcador, podrás acceder a Google de varias formas:
Make Google your search engine	Establecer Google como motor de búsqueda
Get to Google on Safari	Acceder a Google desde Safari
Filter your results to only see images.	Filtra los resultados para ver solo imágenes.
Here are the most popular tips for doing Google searches on your phone or tablet.	A continuación, se indican los consejos más populares para hacer búsquedas de Google en el teléfono o en el tablet.
No problem, playing songs by Selena Gomez from your YouTube library.	Perfecto, voy a reproducir canciones de Selena Gómez desde tu biblioteca de YouTube.
No problem, playing songs by Charlie Puth from your Google Play Music library.	Perfecto, voy a reproducir canciones de Charlie Puth desde tu biblioteca de Google Play Música.
No problem, try this music on Netflix instead.	Perfecto, a ver si te gusta cómo suena esto en Netflix.
No problem, try this music on YouTube instead.	Perfecto, a ver si te gusta cómo suena esto en YouTube.
No problem, try this music on Google Play Music instead.	Perfecto, a ver si te gusta cómo suena esto en Google Play Música.
Tee times will be available shortly before the tournament.	Los golpes iniciales estarán disponibles poco antes del torneo.
Ask it questions and tell it to do things.	Hazle preguntas y pídele que lleve a cabo acciones.
To add a fingerprint, go to the system settings on your device	Para añadir una huella digital, ve a la configuración del sistema en el dispositivo
Get definitions, synonyms, translations, and more	Obtén definiciones, sinónimos, traducciones y mucho más
What word do you want to look up?	¿Qué palabra quieres buscar?
Words you looked up	Palabras que has buscado
Updates from local officials	Novedades comunicadas por las autoridades locales
What can we help you with?	¿En qué podemos ayudarte?
Please provide a brief description of how this allegedly infringes your trademark.	Explica brevemente de qué manera consideras que este contenido infringe presuntamente tus derechos de marca.
Please explain in detail how you reached the content.	Explica detalladamente cómo accediste al contenido.
• With new typing suggestions, Gboard can do math and unit conversions for you.	• Gracias a las nuevas sugerencias que se muestran al escribir, Gboard puede realizar cálculos y conversiones de unidades por ti.
• Gboard now works in Vietnamese.	• Ahora Gboard también está disponible en vietnamita.
Luang Pradit Phairoh’s 136th birthday	136.º aniversario del nacimiento de Luang Pradit Phairoh
Tina Modotti’s 121st birthday	121.º aniversario del nacimiento de Tina Modotti
James Wong Howe’s 118th birthday	118.º aniversario del nacimiento de James Wong Howe
44th Anniversary of Hip Hop	44.º aniversario del hip hop
For example, you’re the only person who will see results that come from your Google Calendar and Gmail.	Por ejemplo, los resultados de Google Calendar y Gmail solo puedes verlos tú.
You can also search for specific types of bills, or bills from a certain time.	También puedes buscar tipos específicos de facturas o facturas de un cierto período de tiempo.
Turn results from other products on or off	Activar y desactivar los resultados de otros productos
For example, you can search for information about your upcoming flights, restaurant reservations, or appointments.	Por ejemplo, puedes buscar información sobre tus próximos vuelos, citas o reservas en restaurantes.
Receive news and search results via email	Recibe noticias y resultados de búsquedas por correo electrónico
View your emails messages and settings	Consultar tus mensajes de correo electrónico y tu configuración
Create this list with…	Crear esta lista con…
Add to my shopping list	Añadir a mi lista de la compra
Find images, text, and videos you can reuse	Encontrar imágenes, texto y vídeos que puedas volver a utilizar
Cannot determine your current location.	No se ha podido determinar tu ubicación.
Get a lower price with free membership	Descuentos con la suscripción gratuita
Get a lower price with free enrollment	Descuentos con la inscripción gratuita
Get a lower price with free loyalty sign-up	Descuentos con el programa de fidelización gratuito
Enter a city or zip code	Escribe una ciudad o un código postal
Check availability at libraries near you	Consulta la disponibilidad en bibliotecas cercanas
That itinerary was not found. Check out some other suggested itineraries.	No se ha podido encontrar el itinerario. Consulta las rutas que te sugerimos.
This condition often has no symptoms	Este estado de salud no suele tener síntomas
Dangerous and harmful activity in predictions	Actividad peligrosa y dañina en las predicciones
Pornographic terms or terms that are closely associated with pornography are removed from predictions.	Los términos pornográficos o estrechamente relacionados con la pornografía también se retiran.
Hateful predictions against groups and individuals	Predicciones que incitan a odiar grupos o personas
There were five flights on your schedule. Here are the first three:	Hay cinco vuelos en tu agenda. Estos son los tres primeros:
If you want to play another time, just let me know.	Si quieres jugar en otro momento, no tienes más que decírmelo.
You had five reservations. Here are the first three:	Tienes cinco reservas. Estas son las tres primeras:
There were five flights on your schedule this week. Here are the first three:	Hay cinco vuelos en tu agenda esta semana. Estos son los tres primeros:
Last chance to play. Do you need me to say the games again?	Última oportunidad de jugar: ¿quieres que vuelva a decirte los juegos?
Manage your Ad Exchange buyer account configuration	Administra la configuración de tu cuenta de Ad Exchange Buyer.
Video failed to load	No se ha podido cargar el vídeo
View participating films on Google.	Consulta las candidaturas en Google.
Home address provided to Google.	Dirección de casa proporcionada a Google.
Add text and drawings	Añade texto y dibujos
Adjust pen type, color, and size	Ajusta el tipo de herramienta, el color y el tamaño
Sign in to see your upcoming and past trips	Inicia sesión para ver tus próximos viajes y los anteriores
A user suggested this website	Un usuario ha sugerido este sitio web
A user suggested this phone	Un usuario ha sugerido este número de teléfono
A user suggested new info	Un usuario ha sugerido nuevos datos
View all Google Photos results	Ver todos los resultados de Google Fotos
A user suggested new hours to Google.	Un usuario ha sugerido un nuevo horario a Google.
A user suggested a new category to Google.	Un usuario ha sugerido una nueva categoría a Google.
A user suggested these hours	Un usuario ha sugerido este horario
A user suggested a new name to Google.	Un usuario ha sugerido un nuevo nombre a Google.
A user suggested a new phone number to Google.	Un usuario ha sugerido un nuevo número de teléfono a Google.
A user suggested a new website to Google.	Un usuario ha sugerido un nuevo sitio web a Google.
All your permissions have been granted.	Se han concedido todos tus permisos.
Add a shortcut to Reminders from your home screen?	¿Quieres añadir un acceso directo a Recordatorios en la pantalla de inicio?
Turn on location to share your location and more.	Activa la ubicación para compartirla y mucho más.
Have a new page? Let us know.	¿Tienes una nueva página? Ponte en contacto con nosotros.
Expanded Currency Contents Group	Grupo de contenidos de moneda ampliado
Tap a section to translate	Toca una sección para traducirla
Click a section to translate	Haz clic en una sección para traducirla
Check if you're registered to vote	Comprueba si estás registrado para votar
Here's how to vote in Canada	Instrucciones sobre cómo votar en Canadá
There's info about stocks you've starred on Google.	Hay información sobre acciones que has destacado en Google.
information about you that this advertiser shared with Google	información sobre ti que este anunciante ha compartido con Google
Manage your visibility settings and the data we use to tailor your experience.	Administra la configuración de visibilidad y los datos que utilizamos para personalizar tu experiencia.
Read about how your feedback helps improve Google search.	Descubre cómo nos ayudan tus comentarios a mejorar la Búsqueda de Google.
There's info about stuff you've starred on Google.	Hay información sobre cosas que has destacado en Google.
Manage your password, recovery options, and the apps and devices that can access your account.	Administra tu contraseña, opciones de recuperación y las aplicaciones y dispositivos que pueden acceder a tu cuenta.
Here's how to register to vote in Canada	Instrucciones sobre cómo inscribirse para votar en Canadá
The practical sort, you know just when to curl up into a ball to thwart predators.	De tipo práctico, sabes justo cuándo hacerte una bolita para frustrar los planes de los depredadores.
Update the Google app for a better search experience	Actualiza la aplicación de Google para mejorar la experiencia de búsqueda
Please explain your edit suggestion above.	Explica el cambio que nos has sugerido arriba.
Did you already purchase this?	¿Ya has comprado esto?
Review important privacy settings, and adjust them to your preference.	Revisa las importantes opciones de configuración de privacidad y modifícalas como prefieras.
Click on the image you'd like to report	Haz clic en la imagen que quieres denunciar
Consult a doctor. Interactions can occur	Consulta a un médico. Pueden producirse interacciones
Find and remember your current location:	Buscar y recordar tu ubicación actual:
Visits to other websites	Visitas a otros sitios web
Click here to sign in	Haga clic aquí para acceder
Tell Google what to do	Dile a Google qué quieres hacer
You will be directed to the business site to complete your booking.	Se te redirigirá al sitio de la empresa para completar tu reserva.
Work here? Complete this listing	¿Trabajas aquí? Completa esta ficha
Tap on the image you'd like to report	Toca la imagen que quieres denunciar
Protect your account by reviewing your security settings and recent activity.	Revisa tu configuración de seguridad y tu actividad reciente para proteger tu cuenta.
Home address provided to Google	Dirección de casa proporcionada a Google
home address provided to Google	dirección de casa proporcionada a Google
We'll do our best to keep ads like this out of your way in the future.	Haremos todo lo posible para no volver a mostrarte este tipo de anuncios en el futuro.
Are you in crisis? Call and talk to someone now.	¿Necesitas ayuda? Llama y habla con un profesional.
Google may contact you about your edit suggestion.	Google puede ponerse en contacto contigo para consultarte tus cambios sugeridos.
Whoops! You're using an account that can't go here.	¡Vaya! Estás utilizando una cuenta que no puede acceder aquí.
Thank you for the feedback.	Gracias por tus comentarios
The data you provide helps improve Google Search.	Los datos que proporcionas ayudan a mejorar la Búsqueda de Google.
You will no longer be shown suggestions based on your contacts.	Ya no aparecerán sugerencias basadas en tus contactos.
We'll do our best to show you more relevant ads in the future.	Haremos todo lo posible para mostrarte anuncios relevantes en el futuro.
Does the grouping above seem accurate?	¿El grupo anterior parece exacto?
Information entered here will be sent to the advertiser.	La información introducida aquí se enviará al anunciante.
Did you find this page useful?	¿Te ha resultado útil esta página?
Thank you! The business will email you soon.	¡Gracias! Pronto recibirás un mensaje de correo electrónico de la empresa.
Gives you the latest entries from your favorite sites	Te proporciona las últimas entradas de tus sitios favoritos
This Google Scholar Alert is brought to you by Google.	Google te proporciona esta alerta de Google Académico.
Google can use your location to offer better results.	Google puede utilizar tu ubicación para ofrecer mejores resultados.
Ads pay for the Google products you use every day.	La publicidad permite que puedas disfrutar de los productos de Google que utilizas a diario.
You seem to be using an unsupported browser.	Parece que estás usando un navegador no admitido.
Stocks you starred in Google Search appear here.	Las acciones que hayas destacado en la Búsqueda de Google aparecerán aquí.
Local recommendations powered by you and your friends.	Recomendaciones locales basadas en tus valoraciones y en las de tus amigos
Create multiple Shortlists when you sign in with your Google Account.	Cuando inicies sesión con tu cuenta de Google, podrás crear varias listas.
Please try the new Google Maps the next time you're on a desktop or laptop computer.	Prueba el nuevo Google Maps la próxima vez que accedas desde un ordenador portátil o de sobremesa.
We won't show this ad to you again.	No se volverá a mostrar este anuncio.
Are you in crisis? Call one of these resources and talk to someone now.	¿Necesitas ayuda? Llama a uno de estos números de teléfono y te ayudaremos.
Here are some pictures you might like.	Aquí tienes algunas imágenes que te pueden gustar.
Photos from you and your friends	Fotos tuyas y de tus amigos
Here are some videos you might like.	Aquí tienes algunos vídeos que te pueden gustar.
Information you submit will be shared with this advertiser.	La información que envíes se compartirá con este anunciante.
Help us make ads better and tell us why you closed the ad.	Ayúdanos a mejorar los anuncios y dinos por qué has cerrado este anuncio.
Thank you! The business will call you soon.	¡Gracias! Pronto recibirás una llamada de la empresa.
By using our services, you agree to our use of cookies.	Al utilizar nuestros servicios, aceptas el uso que hacemos de las cookies.
The search option you have selected is currently unavailable.	La opción de búsqueda seleccionada no se encuentra disponible actualmente.
Sorry, the new Google Maps does not support the browser you are using.	El nuevo Google Maps no es compatible con el navegador que estás utilizando.
Your reviews are your own	Tus reseñas son de tu propiedad.
To get reminders, turn on Now cards	Para recibir recordatorios, activa las tarjetas de Google Now
You have successfully signed up to be contacted.	Te has registrado correctamente para que nos pongamos en contacto contigo.
Try searching for a movie name or your location.	Intente buscar por el título de la película o el nombre de su localidad.
Say a time, location, or contact	Di una hora, una ubicación o un contacto
Looking for your restaurant reservations?	¿Buscas reservas de restaurantes?
There are no results here. Try searching in a different location.	No se han obtenido resultados. Prueba a buscar en una ubicación diferente.
When you submit this form, your email address will be sent to the advertiser.	Al enviar este formulario, tu dirección de correo electrónico se enviará al anunciante.
Publish your message through your blog	Publica tu mensaje en tu blog
Bring your nose as close as you can to the screen and press Enter.	Acerca la nariz todo lo que puedas a la pantalla y pulsa Intro.
Looking for your trip reservations?	¿Buscas tus reservas de viajes?
Verify that the lock is correctly activated and that no tampering has taken place.	Verifica que el bloqueo esté correctamente activado y que no se haya intentado desactivar.
You have successfully signed up to receive updates.	Te has registrado correctamente para recibir actualizaciones.
Try saying the other name	Intenta decir el otro nombre
Ads help pay for the Google products you use every day.	La publicidad permite que puedas disfrutar de los productos de Google que utilizas a diario.
Sign in to try it out.	Inicia sesión para probarla.
This restaurant requires a credit card to make a reservation. To complete your request, go to opentable.com.	Este restaurante requiere una tarjeta de crédito para realizar una reserva. Para completar tu solicitud, accede a opentable.com.
Not sure. Call, or explore these web pages to find out the opening hours.	No estoy seguro. Llama o explora estas páginas web para consultar el horario comercial.
Visit our help center to learn more.	Para obtener más información, accede al Centro de ayuda.
Touch the microphone and start talking to search, get directions, and much more.	Toca el micrófono y empieza a hablar para hacer búsquedas, obtener indicaciones sobre cómo llegar a un sitio y mucho más.
To use this voice action, you need the latest version of the Google Search app.	Para utilizar esta acción de voz, necesitas la última versión de la aplicación Búsqueda de Google.
To ensure a word is included, precede it with a plus sign:	Para asegurarte de que se incluye una palabra, incluye el signo "+" delante:
Turn on Google Now to set reminders for dates, times and locations.	Activa Google Now para establecer recordatorios de fechas, horas y ubicaciones.
Select the address you want to move:	Selecciona la dirección que quieras mover:
Make Google Suggest Your Homepage!	Haga de Google Suggest su página principal.
Be one of the first to try the new Google Maps.	Sé el primero en probar el nuevo Google Maps.
Why are you reporting this image?	¿Por qué nos informas de esta imagen?
Try removing quotes from your search to get more results.	Elimine las comillas de la búsqueda para obtener más resultados.
You need the latest Google app	Necesitas la aplicación de Google más reciente
To search for an exact word, precede it with a plus sign:	Para buscar una palabra exacta, incluye el signo "+" delante:
Work here? Verify this business	¿Trabajas aquí? Verifica esta empresa
When you submit this form, your name will be sent to theadvertiser.	Al enviar este formulario, tu nombre se enviará al anunciante.
Can't find that. Try another location	No se puede encontrar esa ubicación. Prueba otra
Try saying the first name, last name, or full name	Prueba a decir el nombre, el apellido o el nombre completo
Screen reader users, click here to turn off streaming.	Los usuarios de lectores de pantalla tienen que hacer clic aquí para desactivar el streaming.
Get the new Google Search app for iPad	Obtener la nueva aplicación de Búsqueda de Google para iPad
Try this search over all books:	Pruebe esta búsqueda en todos los libros:
Know of a better webpage for this search?	¿Conoces una página web mejor para buscar SEARCH_TERMS? Sugiere una.
When you submit this form, your name and zip code will be sent to the advertiser.	Al enviar este formulario, tu nombre y tu código postal se enviarán al anunciante.
Congratulations! You’re in. Get ready to try the new Google Maps.	¡Enhorabuena! Te has registrado. Prepárate para probar el nuevo Google Maps.
You have successfully signed up to receive a quote.	Te has registrado correctamente para recibir un presupuesto.
Looking for your emails?	¿Buscas tus correos electrónicos?
Try this search over all patents:	Pruebe esta búsqueda en todas las patentes:
See a problem with this page? Please tell us.	¿Observa algún problema en esta página? Por favor, indíquenoslo.
Looking for your car rental reservations?	¿Buscas tus reservas de alquiler de coches?
Oh no... Looks like you're blocking ads	Parece que estás bloqueando los anuncios.
Choose one or say Cancel	Selecciona un contacto o di Cancelar
Start game or select player	Iniciar partida o seleccionar jugador
To get customized results, turn on Web History	Para obtener resultados personalizados, activa el historial web
Say a contact's name or say Cancel	Di el nombre de un contacto o Cancelar
Leaving the page will interrupt the operation that is under way. Are you sure you want to leave?	Si sales de la página, se interrumpirá la operación en curso. ¿Seguro que quieres salir?
Your page is full. You must delete a section before adding a new one.	La página está llena. Antes de añadir una nueva sección, debe eliminar una.
You have successfully signed up to receive alerts.	Te has registrado correctamente para recibir alertas.
Hang tight, we'll send you an email soon.	Ten paciencia, te enviaremos un correo electrónico en breve.
You must be registered to vote	Debes estar registrado para votar
You do not have permission to remove this item.	No tienes permiso para eliminar este elemento.
Turn on Web History to get directions from Google Maps.	Activa el historial web para obtener indicaciones de Google Maps.
Help make Google available in more languages	Ayuda a que Google esté disponible en más idiomas
More game info at nba.com	Más información del partido en nba.com
Set an alarm, Send a text, Set a reminder, Open an app, Schedule a meeting, and more...	Establecer una alarma, Enviar un texto, Establecer un recordatorio, Abrir una aplicación, Programar una reunión, etc...
Tell us what problem you are seeing on transit results...	Infórmanos sobre los problemas que veas en los resultados de transporte público...
Make Google News Your Homepage	Haga de Google Noticias su página principal
Got it. We won't interrupt you again during this browser session.	Entendido. No volveremos a interrumpirte durante esta sesión del navegador.
It looks like you're blocking ads.	Parece que estás bloqueando anuncios.
To search for exact words, precede them with a plus sign:	Para buscar palabras exactas, incluye el signo "+" delante:
Learn how to turn off ad blocking just for Google	Puedes desbloquear los anuncios aquí.
Looking for driving directions? Unfortunately this feature is not yet supported.	¿Busca indicaciones para desplazarse en coche? Lamentablemente, aún no disponemos de esta funcionalidad.
Make sure you include URLs to support your edit suggestion.	Asegúrate de incluir direcciones URL que corroboren los cambios que sugieres.
Unlock the SafeSearch preferences.	Desbloquea las preferencias de Búsqueda Segura.
Try these results for your request.	Prueba estos resultados de lo que has solicitado.
The source page of this image can be found at:	La página de origen de esta imagen se encuentra en:
When you submit this form, your name will be sent to the advertiser.	Al enviar este formulario, tu nombre se enviará al anunciante.
Get a Google-enhanced search box	Obtén la caja de búsqueda optimizada de Google.
Find blogs on your favorite topics	Busca los temas más recientes de los blogs.
Looking for currency conversions? Unfortunately, this feature is not supported.	¿Desea convertir divisas? Lamentablemente, no disponemos de esta funcionalidad.
When you submit this form, your phone number and name will be sent to the advertiser.	Al enviar este formulario, tu número de teléfono y tu nombre se enviarán al anunciante.
Looking for your hotel reservations?	¿Buscas tus reservas de hoteles?
When you submit this form, your zip code will be sent to the advertiser.	Al enviar este formulario, tu código postal se enviará al anunciante.
Please select one or more images to report.	Selecciona una o varias imágenes para la notificación.
When you submit this form, your name and email address will be sent to the advertiser.	Al enviar este formulario, tu nombre y tu dirección de correo electrónico se enviarán al anunciante.
Oh no... Looks like you're blocking ads on Google	Parece que estás bloqueando los anuncios.
You will get updates on Google Now	Recibirás novedades en Google Now
Place it at the correct location, if we got it wrong on the map.	Colócalo en la ubicación correcta si aparece mal en el mapa.
Locking could not be completed across all Google domains. Try the verify option later to address these problems.	No se ha podido completar el bloqueo en todos los dominios de Google. Prueba la opción de verificación más tarde para solucionar el problema.
Search for your favorite books	Busca tus libros favoritos
Search blogs from all over the web	Busque blogs en toda la web
When you submit this form, your phone number will be sent to the advertiser.	Al enviar este formulario, tu número de teléfono se enviará al anunciante.
When you submit this form, your zip code and email address will be sent to the advertiser.	Al enviar este formulario, tu código postal y tu dirección de correo electrónico se enviarán al anunciante.
Try saying the first or last name	Intenta decir el nombre o los apellidos
Only you can see these results	Solo puedes ver estos resultados
